{
  "type": "ObjectBranch",
  "version": 1,
  "actor": "zQmct14c746QP7rn5ntddES8568jyfR74k3BjVwNd6eUsNR",
  "subject": "object:zQmUWjX3V2xogBX6yjdpQq8B43GVhUzDzhnWmWUG4pcSXAF",
  "created_at": "2026-10-18T20:46:51Z",
  "previous": [],
  "body": {
    "object": "zQmUWjX3V2xogBX6yjdpQq8B43GVhUzDzhnWmWUG4pcSXAF",
    "name": "head",
    "revision": "zQmWcf3aQdLfpooAgEVvBQ2gLcB62GgNr3izc6RJG2iqQgd"
  },
  "signature": {
    "actor": "zQmct14c746QP7rn5ntddES8568jyfR74k3BjVwNd6eUsNR",
    "key_id": "zQmQ1diMVWJH9Knxo2KFfSZz4Ss1vHogbBFyVGecLVdaeDQ",
    "algorithm": "ed25519",
    "bytes": "o+UrTuXf8fZzhmAcC6GP7PtvofQ8oy5FiWxNhJOteW1a4kMaaQ/8AvftfvEqDuHjdCOdDqxXTdQ4NGUaKk+OAQ=="
  }
}